"DESCRIPTION","DURATION IN MS","NAME","PARENT SUITE","START TIME","STATUS","STOP TIME","SUB SUITE","SUITE","TEST CLASS","TEST METHOD"
"","951","should not have any automatically detectable accessibility issues","Chrome","Sun Mar 01 22:09:01 UTC 2026","passed","Sun Mar 01 22:09:02 UTC 2026","Accessibility Tests","tests/a11y.spec.ts","",""
"","53","GET /api/colors/Yellow should return the correct hex code","Chrome","Sun Mar 01 22:09:03 UTC 2026","failed","Sun Mar 01 22:09:03 UTC 2026","Backend API Integration","tests/api.spec.ts","",""
"","49","GET /api/colors/Red should return the correct hex code","Chrome","Sun Mar 01 22:09:02 UTC 2026","failed","Sun Mar 01 22:09:02 UTC 2026","Backend API Integration","tests/api.spec.ts","",""
"","5297","should maintain accessibility in el language and verify resilient locators","Chrome","Sun Mar 01 22:09:45 UTC 2026","failed","Sun Mar 01 22:09:50 UTC 2026","i18n Accessibility Tests","tests/a11y.spec.ts","",""
"","30025","changing color to Red should reflect in UI and DOM","Chrome","Sun Mar 01 22:10:53 UTC 2026","broken","Sun Mar 01 22:11:23 UTC 2026","Data-Driven Testing","tests/data-driven.spec.ts","",""
"","30022","verify Red ( #e74c3c ) is applied as the background color","Chrome","Sun Mar 01 22:11:08 UTC 2026","broken","Sun Mar 01 22:11:38 UTC 2026","POM Refactored: Background color tests","tests/pom-refactored.spec.ts","",""
"","30019","verify Turquoise ( #1abc9c ) is applied as the background color","Chrome","Sun Mar 01 22:09:04 UTC 2026","broken","Sun Mar 01 22:09:34 UTC 2026","Background color tests","tests/coverage.spec.ts","",""
"","227","mock API response (example demonstration)","Chrome","Sun Mar 01 22:10:36 UTC 2026","passed","Sun Mar 01 22:10:37 UTC 2026","Network Mocking & Interception","tests/network-mocking.spec.ts","",""
"","30036","verify Yellow ( #f1c40f ) is applied as the background color","Chrome","Sun Mar 01 22:10:05 UTC 2026","broken","Sun Mar 01 22:10:35 UTC 2026","Background color tests","tests/coverage.spec.ts","",""
"","30023","verify Yellow ( #f1c40f ) is applied as the background color","Chrome","Sun Mar 01 22:11:38 UTC 2026","broken","Sun Mar 01 22:12:08 UTC 2026","POM Refactored: Background color tests","tests/pom-refactored.spec.ts","",""
"","276","should handle missing image gracefully by showing alt text","Chrome","Sun Mar 01 22:10:36 UTC 2026","passed","Sun Mar 01 22:10:36 UTC 2026","Network Mocking & Interception","tests/network-mocking.spec.ts","",""
"","278","check Turquoise ( #1abc9c) is the default background color.","Chrome","Sun Mar 01 22:09:03 UTC 2026","passed","Sun Mar 01 22:09:04 UTC 2026","","tests/coverage.spec.ts","",""
"","30027","verify Red ( #e74c3c ) is applied as the background color","Chrome","Sun Mar 01 22:09:34 UTC 2026","broken","Sun Mar 01 22:10:04 UTC 2026","Background color tests","tests/coverage.spec.ts","",""
"","30025","should maintain accessibility after state change (color update)","Chrome","Sun Mar 01 22:09:02 UTC 2026","broken","Sun Mar 01 22:09:32 UTC 2026","Accessibility Tests","tests/a11y.spec.ts","",""
"","5302","should maintain accessibility in es language and verify resilient locators","Chrome","Sun Mar 01 22:09:39 UTC 2026","failed","Sun Mar 01 22:09:44 UTC 2026","i18n Accessibility Tests","tests/a11y.spec.ts","",""
"","52","GET /api/colors/Turquoise should return the correct hex code","Chrome","Sun Mar 01 22:09:01 UTC 2026","failed","Sun Mar 01 22:09:01 UTC 2026","Backend API Integration","tests/api.spec.ts","",""
"","30024","changing color to Yellow should reflect in UI and DOM","Chrome","Sun Mar 01 22:11:24 UTC 2026","broken","Sun Mar 01 22:11:54 UTC 2026","Data-Driven Testing","tests/data-driven.spec.ts","",""
"","30023","changing color to Turquoise should reflect in UI and DOM","Chrome","Sun Mar 01 22:10:22 UTC 2026","broken","Sun Mar 01 22:10:52 UTC 2026","Data-Driven Testing","tests/data-driven.spec.ts","",""
"","5296","should maintain accessibility in en language and verify resilient locators","Chrome","Sun Mar 01 22:09:33 UTC 2026","failed","Sun Mar 01 22:09:38 UTC 2026","i18n Accessibility Tests","tests/a11y.spec.ts","",""
"","30024","should load the application and verify core functionality across browsers","Chrome","Sun Mar 01 22:09:51 UTC 2026","broken","Sun Mar 01 22:10:21 UTC 2026","Cross-Browser Core Functionality","tests/cross-browser.spec.ts","",""
"","30021","verify Turquoise ( #1abc9c ) is applied as the background color","Chrome","Sun Mar 01 22:10:37 UTC 2026","broken","Sun Mar 01 22:11:07 UTC 2026","POM Refactored: Background color tests","tests/pom-refactored.spec.ts","",""
