"DESCRIPTION","DURATION IN MS","NAME","PARENT SUITE","START TIME","STATUS","STOP TIME","SUB SUITE","SUITE","TEST CLASS","TEST METHOD"
"","1321","should not have any automatically detectable accessibility issues","Chrome","Fri Feb 27 18:28:11 UTC 2026","passed","Fri Feb 27 18:28:12 UTC 2026","Accessibility Tests","tests/a11y.spec.ts","",""
"","309","verify Yellow ( #f1c40f ) is applied as the background color","Chrome","Fri Feb 27 18:28:16 UTC 2026","passed","Fri Feb 27 18:28:16 UTC 2026","POM Refactored: Background color tests","tests/pom-refactored.spec.ts","",""
"","426","changing color to Turquoise should reflect in UI and DOM","Chrome","Fri Feb 27 18:28:13 UTC 2026","passed","Fri Feb 27 18:28:14 UTC 2026","Data-Driven Testing","tests/data-driven.spec.ts","",""
"","1052","should maintain accessibility in en language and verify resilient locators","Chrome","Fri Feb 27 18:28:14 UTC 2026","passed","Fri Feb 27 18:28:15 UTC 2026","i18n Accessibility Tests","tests/a11y.spec.ts","",""
"","418","changing color to Red should reflect in UI and DOM","Chrome","Fri Feb 27 18:28:14 UTC 2026","passed","Fri Feb 27 18:28:14 UTC 2026","Data-Driven Testing","tests/data-driven.spec.ts","",""
"","868","should maintain accessibility in es language and verify resilient locators","Chrome","Fri Feb 27 18:28:15 UTC 2026","passed","Fri Feb 27 18:28:16 UTC 2026","i18n Accessibility Tests","tests/a11y.spec.ts","",""
"","378","should render correctly on mobile viewport","Chrome","Fri Feb 27 18:29:12 UTC 2026","passed","Fri Feb 27 18:29:12 UTC 2026","Responsive Design Testing","tests/visual.spec.ts","",""
"","641","check Turquoise ( #1abc9c) is the default background color.","Chrome","Fri Feb 27 18:28:11 UTC 2026","passed","Fri Feb 27 18:28:12 UTC 2026","","tests/coverage.spec.ts","",""
"","458","verify Red ( #e74c3c ) is applied as the background color","Chrome","Fri Feb 27 18:28:12 UTC 2026","passed","Fri Feb 27 18:28:13 UTC 2026","Background color tests","tests/coverage.spec.ts","",""
"","446","verify Yellow ( #f1c40f ) is applied as the background color","Chrome","Fri Feb 27 18:28:13 UTC 2026","passed","Fri Feb 27 18:28:13 UTC 2026","Background color tests","tests/coverage.spec.ts","",""
"","339","verify Red ( #e74c3c ) is applied as the background color","Chrome","Fri Feb 27 18:28:16 UTC 2026","passed","Fri Feb 27 18:28:16 UTC 2026","POM Refactored: Background color tests","tests/pom-refactored.spec.ts","",""
"","501","homepage should match snapshot","Chrome","Fri Feb 27 18:29:11 UTC 2026","passed","Fri Feb 27 18:29:11 UTC 2026","Visual Regression","tests/visual.spec.ts","",""
"","287","should handle missing image gracefully by showing alt text","Chrome","Fri Feb 27 18:28:15 UTC 2026","passed","Fri Feb 27 18:28:15 UTC 2026","Network Mocking & Interception","tests/network-mocking.spec.ts","",""
"","293","verify Turquoise ( #1abc9c ) is applied as the background color","Chrome","Fri Feb 27 18:28:15 UTC 2026","passed","Fri Feb 27 18:28:16 UTC 2026","POM Refactored: Background color tests","tests/pom-refactored.spec.ts","",""
"","497","verify Turquoise ( #1abc9c ) is applied as the background color","Chrome","Fri Feb 27 18:28:12 UTC 2026","passed","Fri Feb 27 18:28:12 UTC 2026","Background color tests","tests/coverage.spec.ts","",""
"","1249","should maintain accessibility after state change (color update)","Chrome","Fri Feb 27 18:28:13 UTC 2026","passed","Fri Feb 27 18:28:14 UTC 2026","Accessibility Tests","tests/a11y.spec.ts","",""
"","275","mock API response (example demonstration)","Chrome","Fri Feb 27 18:28:15 UTC 2026","passed","Fri Feb 27 18:28:15 UTC 2026","Network Mocking & Interception","tests/network-mocking.spec.ts","",""
"","785","should maintain accessibility in el language and verify resilient locators","Chrome","Fri Feb 27 18:28:16 UTC 2026","passed","Fri Feb 27 18:28:17 UTC 2026","i18n Accessibility Tests","tests/a11y.spec.ts","",""
"","607","changing color to Yellow should reflect in UI and DOM","Chrome","Fri Feb 27 18:28:14 UTC 2026","passed","Fri Feb 27 18:28:15 UTC 2026","Data-Driven Testing","tests/data-driven.spec.ts","",""
